{
  "format": "zoia-patch",
  "schemaVersion": 1,
  "documentId": "nts4-performance-rig-v1",
  "name": "NTS4 Loop Wash",
  "authoringMode": "free",
  "modules": [
    {
      "id": "audio-in",
      "configurationId": "audio-input-stereo",
      "name": "NTS-4 Send",
      "type": "Audio Input",
      "category": "Interface",
      "parameters": [],
      "endpoints": [
        {
          "id": "output_L",
          "key": "output_L",
          "name": "Output L",
          "kind": "audioOutput",
          "hardwareBlockIndex": 0
        },
        {
          "id": "output_R",
          "key": "output_R",
          "name": "Output R",
          "kind": "audioOutput",
          "hardwareBlockIndex": 1
        }
      ],
      "hardware": null
    },
    {
      "id": "audio-out",
      "configurationId": "audio-output-stereo",
      "name": "NTS-4 Return",
      "type": "Audio Output",
      "category": "Interface",
      "parameters": [],
      "endpoints": [
        {
          "id": "input_L",
          "key": "input_L",
          "name": "Input L",
          "kind": "audioInput",
          "hardwareBlockIndex": 0
        },
        {
          "id": "input_R",
          "key": "input_R",
          "name": "Input R",
          "kind": "audioInput",
          "hardwareBlockIndex": 1
        }
      ],
      "hardware": null
    },
    {
      "id": "midi-clock",
      "configurationId": "midi-clock-in",
      "name": "OP-XY Clock",
      "type": "Midi Clock In",
      "category": "Interface",
      "parameters": [],
      "endpoints": [
        {
          "id": "quarter_out",
          "key": "quarter_out",
          "name": "Quarter Out",
          "kind": "cvOutput",
          "hardwareBlockIndex": 0
        }
      ],
      "hardware": null
    },
    {
      "id": "bar-clock",
      "configurationId": "clock-divider",
      "name": "1 Bar Clock",
      "type": "Clock Divider",
      "category": "CV",
      "parameters": [
        {
          "id": "parameter-0",
          "key": "cv_input",
          "kind": "parameter",
          "name": "Cv Input",
          "rawValue": 0,
          "displayValue": "Configured in Patch Document",
          "decoded": true,
          "unit": "Hz",
          "range": [
            0,
            40
          ]
        },
        {
          "id": "parameter-1",
          "key": "reset_in",
          "kind": "parameter",
          "name": "Reset In",
          "rawValue": 0,
          "displayValue": "Configured in Patch Document",
          "decoded": true,
          "unit": null,
          "range": [
            0,
            1
          ]
        },
        {
          "id": "parameter-2",
          "key": "modifier",
          "kind": "parameter",
          "name": "Modifier",
          "rawValue": 0,
          "displayValue": "Configured in Patch Document",
          "decoded": true,
          "unit": null,
          "range": [
            0,
            1
          ]
        }
      ],
      "endpoints": [
        {
          "id": "cv_input",
          "key": "cv_input",
          "name": "Cv Input",
          "kind": "cvInput",
          "hardwareBlockIndex": 0
        },
        {
          "id": "reset_in",
          "key": "reset_in",
          "name": "Reset In",
          "kind": "cvInput",
          "hardwareBlockIndex": 1
        },
        {
          "id": "modifier",
          "key": "modifier",
          "name": "Modifier",
          "kind": "cvInput",
          "hardwareBlockIndex": 2
        },
        {
          "id": "cv_output",
          "key": "cv_output",
          "name": "Cv Output",
          "kind": "cvOutput",
          "hardwareBlockIndex": 3
        }
      ],
      "hardware": null
    },
    {
      "id": "phrase-clock",
      "configurationId": "clock-divider",
      "name": "4 Bar Clock",
      "type": "Clock Divider",
      "category": "CV",
      "parameters": [
        {
          "id": "parameter-0",
          "key": "cv_input",
          "kind": "parameter",
          "name": "Cv Input",
          "rawValue": 0,
          "displayValue": "Configured in Patch Document",
          "decoded": true,
          "unit": "Hz",
          "range": [
            0,
            40
          ]
        },
        {
          "id": "parameter-1",
          "key": "reset_in",
          "kind": "parameter",
          "name": "Reset In",
          "rawValue": 0,
          "displayValue": "Configured in Patch Document",
          "decoded": true,
          "unit": null,
          "range": [
            0,
            1
          ]
        },
        {
          "id": "parameter-2",
          "key": "modifier",
          "kind": "parameter",
          "name": "Modifier",
          "rawValue": 0,
          "displayValue": "Configured in Patch Document",
          "decoded": true,
          "unit": null,
          "range": [
            0,
            1
          ]
        }
      ],
      "endpoints": [
        {
          "id": "cv_input",
          "key": "cv_input",
          "name": "Cv Input",
          "kind": "cvInput",
          "hardwareBlockIndex": 0
        },
        {
          "id": "reset_in",
          "key": "reset_in",
          "name": "Reset In",
          "kind": "cvInput",
          "hardwareBlockIndex": 1
        },
        {
          "id": "modifier",
          "key": "modifier",
          "name": "Modifier",
          "kind": "cvInput",
          "hardwareBlockIndex": 2
        },
        {
          "id": "cv_output",
          "key": "cv_output",
          "name": "Cv Output",
          "kind": "cvOutput",
          "hardwareBlockIndex": 3
        }
      ],
      "hardware": null
    },
    {
      "id": "crossfade-cc",
      "configurationId": "midi-cc-20",
      "name": "Crossfade CC20",
      "type": "Midi CC In",
      "category": "Interface",
      "parameters": [],
      "endpoints": [
        {
          "id": "cc_out",
          "key": "cc_out",
          "name": "Cc Out",
          "kind": "cvOutput",
          "hardwareBlockIndex": 0
        }
      ],
      "hardware": null
    },
    {
      "id": "loop-trigger",
      "configurationId": "midi-notes-loop-trigger",
      "name": "Loop Rec Note60",
      "type": "Midi Notes In",
      "category": "Interface",
      "parameters": [],
      "endpoints": [
        {
          "id": "note_out_1",
          "key": "note_out_1",
          "name": "Note Out 1",
          "kind": "cvOutput",
          "hardwareBlockIndex": 0
        },
        {
          "id": "gate_out_1",
          "key": "gate_out_1",
          "name": "Gate Out 1",
          "kind": "cvOutput",
          "hardwareBlockIndex": 1
        },
        {
          "id": "trigger_out_1",
          "key": "trigger_out_1",
          "name": "Trigger Out 1",
          "kind": "cvOutput",
          "hardwareBlockIndex": 3
        }
      ],
      "hardware": null
    },
    {
      "id": "record-quantize",
      "configurationId": "sequencer-quantize-one-shot",
      "name": "Record Quantize",
      "type": "Sequencer",
      "category": "CV",
      "parameters": [
        {
          "id": "parameter-0",
          "key": "step_1",
          "kind": "parameter",
          "name": "Step 1",
          "rawValue": 65535,
          "displayValue": "Configured in Patch Document",
          "decoded": true,
          "unit": "Notes",
          "range": [
            null,
            null
          ]
        },
        {
          "id": "parameter-1",
          "key": "gate_in",
          "kind": "parameter",
          "name": "Gate In",
          "rawValue": 0,
          "displayValue": "Configured in Patch Document",
          "decoded": true,
          "unit": null,
          "range": [
            0,
            1
          ]
        },
        {
          "id": "parameter-2",
          "key": "queue_start",
          "kind": "parameter",
          "name": "Queue Start",
          "rawValue": 0,
          "displayValue": "Configured in Patch Document",
          "decoded": true,
          "unit": null,
          "range": [
            0,
            1
          ]
        }
      ],
      "endpoints": [
        {
          "id": "step_1",
          "key": "step_1",
          "name": "Step 1",
          "kind": "cvInput",
          "hardwareBlockIndex": 0
        },
        {
          "id": "gate_in",
          "key": "gate_in",
          "name": "Gate In",
          "kind": "cvInput",
          "hardwareBlockIndex": 32
        },
        {
          "id": "queue_start",
          "key": "queue_start",
          "name": "Queue Start",
          "kind": "cvInput",
          "hardwareBlockIndex": 33
        },
        {
          "id": "out_track_1",
          "key": "out_track_1",
          "name": "Out Track 1",
          "kind": "cvOutput",
          "hardwareBlockIndex": 36
        }
      ],
      "hardware": null
    },
    {
      "id": "pump-lfo",
      "configurationId": "lfo-sidechain-ramp",
      "name": "Quarter Pump",
      "type": "LFO",
      "category": "CV",
      "parameters": [
        {
          "id": "parameter-0",
          "key": "tap_control",
          "kind": "parameter",
          "name": "Tap Control",
          "rawValue": 0,
          "displayValue": "Configured in Patch Document",
          "decoded": true,
          "unit": "BPM",
          "range": [
            2,
            2400
          ]
        },
        {
          "id": "parameter-1",
          "key": "phase_reset",
          "kind": "parameter",
          "name": "Phase Reset",
          "rawValue": 0,
          "displayValue": "Configured in Patch Document",
          "decoded": true,
          "unit": null,
          "range": [
            0,
            1
          ]
        }
      ],
      "endpoints": [
        {
          "id": "tap_control",
          "key": "tap_control",
          "name": "Tap Control",
          "kind": "cvInput",
          "hardwareBlockIndex": 1
        },
        {